<?xml version="1.0" encoding="UTF-8"?>
<xs:schema xmlns:xs="http://www.w3.org/2001/XMLSchema">
	<xs:element name="list">
		<xs:complexType>
			<xs:sequence>
				<xs:element name="epicraid" maxOccurs="unbounded">
					<xs:complexType>
						<xs:sequence>
							<xs:element name="locationSpawnRaidBoss">
								<xs:complexType>
									<xs:attribute name="x" type="xs:int"></xs:attribute>
									<xs:attribute name="y" type="xs:int"></xs:attribute>
									<xs:attribute name="z" type="xs:int"></xs:attribute>
								</xs:complexType>
							</xs:element>
                            <xs:element name="playerTeleport">
                                <xs:complexType>
                                    <xs:sequence>
                                        <xs:element name="locationTeleportPlayer" maxOccurs="unbounded">
                                            <xs:complexType>
                                                <xs:attribute name="x" type="xs:int"></xs:attribute>
                                                <xs:attribute name="y" type="xs:int"></xs:attribute>
                                                <xs:attribute name="z" type="xs:int"></xs:attribute>
                                            </xs:complexType>
                                        </xs:element>
                                    </xs:sequence>
                                </xs:complexType>
							</xs:element>
                            <xs:element name="locationTeleZone">
                                <xs:complexType>
                                    <xs:attribute name="x" type="xs:int"></xs:attribute>
                                    <xs:attribute name="y" type="xs:int"></xs:attribute>
                                    <xs:attribute name="z" type="xs:int"></xs:attribute>
                                </xs:complexType>
                            </xs:element>
                            <xs:element name="locationSpawnNpc">
                                <xs:complexType>
                                    <xs:attribute name="x" type="xs:int"></xs:attribute>
                                    <xs:attribute name="y" type="xs:int"></xs:attribute>
                                    <xs:attribute name="z" type="xs:int"></xs:attribute>
                                </xs:complexType>
                            </xs:element>
                            <xs:element name="zoneInfo">
                                <xs:complexType>
                                    <xs:sequence>
                                        <xs:element name="node" maxOccurs="unbounded">
                                            <xs:complexType>
                                                <xs:attribute name="X" type="xs:int"></xs:attribute>
                                                <xs:attribute name="Y" type="xs:int"></xs:attribute>
                                            </xs:complexType>
                                        </xs:element>
                                    </xs:sequence>
                                    <xs:attribute name="name" type="xs:string"></xs:attribute>
                                    <xs:attribute name="id" type="xs:int"></xs:attribute>
                                    <xs:attribute name="minZ" type="xs:int"></xs:attribute>
                                    <xs:attribute name="maxZ" type="xs:int"></xs:attribute>
                                </xs:complexType>
                            </xs:element>
						</xs:sequence>
						<xs:attribute name="npcId" type="xs:int"></xs:attribute>
						<xs:attribute name="name" type="xs:string"></xs:attribute>
						<xs:attribute name="imageName" type="xs:string"></xs:attribute>
					</xs:complexType>
				</xs:element>
			</xs:sequence>
		</xs:complexType>
	</xs:element>
</xs:schema>